[I 2023-08-08 11:27:49,253] A new study created in memory with name: no-name-0f62c1d5-7132-49c2-9a96-cd4276e3a2a3
[I 2023-08-08 11:28:47,973] Trial 0 finished with value: 0.4845828155390037 and parameters: {'num_topics': 23, 'alpha_categorical': 'symmetric', 'eta_categorical': 'symmetric'}. Best is trial 0 with value: 0.4845828155390037.
[I 2023-08-08 11:29:45,416] Trial 1 finished with value: 0.4639980553048674 and parameters: {'num_topics': 36, 'alpha_categorical': 'symmetric', 'eta_categorical': 'scalar', 'eta': 0.8621157310351236}. Best is trial 0 with value: 0.4845828155390037.
[I 2023-08-08 11:30:31,281] Trial 2 finished with value: 0.4077356650205924 and parameters: {'num_topics': 40, 'alpha_categorical': 'scalar', 'eta_categorical': 'symmetric', 'alpha': 0.7109916597934982}. Best is trial 0 with value: 0.4845828155390037.
[I 2023-08-08 11:31:22,068] Trial 3 finished with value: 0.5253537135897393 and parameters: {'num_topics': 19, 'alpha_categorical': 'asymmetric', 'eta_categorical': 'scalar', 'eta': 0.6054285712744302}. Best is trial 3 with value: 0.5253537135897393.
[I 2023-08-08 11:32:13,127] Trial 4 finished with value: 0.47477857551063485 and parameters: {'num_topics': 16, 'alpha_categorical': 'scalar', 'eta_categorical': 'symmetric', 'alpha': 0.6174801972935934}. Best is trial 3 with value: 0.5253537135897393.
[I 2023-08-08 11:33:02,497] Trial 5 finished with value: 0.4132073354887448 and parameters: {'num_topics': 5, 'alpha_categorical': 'scalar', 'eta_categorical': 'symmetric', 'alpha': 0.15487322022331598}. Best is trial 3 with value: 0.5253537135897393.
[I 2023-08-08 11:33:52,566] Trial 6 finished with value: 0.5107052359686342 and parameters: {'num_topics': 19, 'alpha_categorical': 'scalar', 'eta_categorical': 'scalar', 'alpha': 0.08587848333614839, 'eta': 0.4082490324642575}. Best is trial 3 with value: 0.5253537135897393.
[I 2023-08-08 11:34:49,435] Trial 7 finished with value: 0.4774937277932224 and parameters: {'num_topics': 33, 'alpha_categorical': 'symmetric', 'eta_categorical': 'symmetric'}. Best is trial 3 with value: 0.5253537135897393.
[I 2023-08-08 11:36:13,142] Trial 8 finished with value: 0.45304162235235695 and parameters: {'num_topics': 35, 'alpha_categorical': 'symmetric', 'eta_categorical': 'scalar', 'eta': 0.5603420568312595}. Best is trial 3 with value: 0.5253537135897393.
[I 2023-08-08 11:37:18,977] Trial 9 finished with value: 0.5077606930351228 and parameters: {'num_topics': 24, 'alpha_categorical': 'scalar', 'eta_categorical': 'symmetric', 'alpha': 0.2105523933897061}. Best is trial 3 with value: 0.5253537135897393.
[I 2023-08-08 11:38:24,733] Trial 10 finished with value: 0.4930472371088001 and parameters: {'num_topics': 11, 'alpha_categorical': 'asymmetric', 'eta_categorical': 'scalar', 'eta': 0.05977793546586485}. Best is trial 3 with value: 0.5253537135897393.
[I 2023-08-08 11:39:13,792] Trial 11 finished with value: 0.47633646233752136 and parameters: {'num_topics': 17, 'alpha_categorical': 'asymmetric', 'eta_categorical': 'scalar', 'eta': 0.4872459263199922}. Best is trial 3 with value: 0.5253537135897393.
[I 2023-08-08 11:40:04,534] Trial 12 finished with value: 0.4732309137442467 and parameters: {'num_topics': 28, 'alpha_categorical': 'asymmetric', 'eta_categorical': 'scalar', 'eta': 0.4514633920935819}. Best is trial 3 with value: 0.5253537135897393.
[I 2023-08-08 11:40:52,649] Trial 13 finished with value: 0.4778231901314202 and parameters: {'num_topics': 17, 'alpha_categorical': 'asymmetric', 'eta_categorical': 'scalar', 'eta': 0.6755837562463175}. Best is trial 3 with value: 0.5253537135897393.
[I 2023-08-08 11:41:38,517] Trial 14 finished with value: 0.47292487059650723 and parameters: {'num_topics': 12, 'alpha_categorical': 'scalar', 'eta_categorical': 'scalar', 'alpha': 0.01936775390930473, 'eta': 0.2623981255645807}. Best is trial 3 with value: 0.5253537135897393.
[I 2023-08-08 11:42:26,686] Trial 15 finished with value: 0.4294283615581877 and parameters: {'num_topics': 28, 'alpha_categorical': 'asymmetric', 'eta_categorical': 'scalar', 'eta': 0.964810640656669}. Best is trial 3 with value: 0.5253537135897393.
[I 2023-08-08 11:43:16,815] Trial 16 finished with value: 0.4832115349557994 and parameters: {'num_topics': 20, 'alpha_categorical': 'asymmetric', 'eta_categorical': 'scalar', 'eta': 0.33109198888312075}. Best is trial 3 with value: 0.5253537135897393.
[I 2023-08-08 11:43:58,936] Trial 17 finished with value: 0.4063696982538108 and parameters: {'num_topics': 11, 'alpha_categorical': 'scalar', 'eta_categorical': 'scalar', 'alpha': 0.9353767270906312, 'eta': 0.6880960117620899}. Best is trial 3 with value: 0.5253537135897393.
[I 2023-08-08 11:44:53,935] Trial 18 finished with value: 0.5102747482938251 and parameters: {'num_topics': 27, 'alpha_categorical': 'scalar', 'eta_categorical': 'scalar', 'alpha': 0.36079902781692275, 'eta': 0.301698581168067}. Best is trial 3 with value: 0.5253537135897393.
[I 2023-08-08 11:45:40,864] Trial 19 finished with value: 0.4277470825981079 and parameters: {'num_topics': 5, 'alpha_categorical': 'asymmetric', 'eta_categorical': 'scalar', 'eta': 0.6931006557232691}. Best is trial 3 with value: 0.5253537135897393.
[I 2023-08-08 11:46:27,990] A new study created in memory with name: no-name-9153d0fe-4083-4d9e-badb-31e61addc872
[I 2023-08-08 11:47:01,725] Trial 0 finished with value: 0.4642061796649965 and parameters: {'num_topics': 11, 'alpha_categorical': 'symmetric', 'eta_categorical': 'scalar', 'eta': 0.002594343509831434}. Best is trial 0 with value: 0.4642061796649965.
[I 2023-08-08 11:47:45,508] Trial 1 finished with value: 0.45615614947067723 and parameters: {'num_topics': 38, 'alpha_categorical': 'scalar', 'eta_categorical': 'scalar', 'alpha': 0.32624773781635363, 'eta': 0.20765183859225622}. Best is trial 0 with value: 0.4642061796649965.
[I 2023-08-08 11:48:25,509] Trial 2 finished with value: 0.48890779668428136 and parameters: {'num_topics': 21, 'alpha_categorical': 'symmetric', 'eta_categorical': 'scalar', 'eta': 0.9193664490236497}. Best is trial 2 with value: 0.48890779668428136.
[I 2023-08-08 11:49:08,812] Trial 3 finished with value: 0.43153085648283296 and parameters: {'num_topics': 37, 'alpha_categorical': 'asymmetric', 'eta_categorical': 'scalar', 'eta': 0.5312298197117078}. Best is trial 2 with value: 0.48890779668428136.
[I 2023-08-08 11:49:45,013] Trial 4 finished with value: 0.46827476404869134 and parameters: {'num_topics': 5, 'alpha_categorical': 'asymmetric', 'eta_categorical': 'symmetric'}. Best is trial 2 with value: 0.48890779668428136.
[I 2023-08-08 11:50:22,656] Trial 5 finished with value: 0.458217743889903 and parameters: {'num_topics': 32, 'alpha_categorical': 'asymmetric', 'eta_categorical': 'symmetric'}. Best is trial 2 with value: 0.48890779668428136.
[I 2023-08-08 11:51:00,687] Trial 6 finished with value: 0.47766763402982904 and parameters: {'num_topics': 25, 'alpha_categorical': 'scalar', 'eta_categorical': 'symmetric', 'alpha': 0.13110071608857018}. Best is trial 2 with value: 0.48890779668428136.
[I 2023-08-08 11:51:37,151] Trial 7 finished with value: 0.45708510551787057 and parameters: {'num_topics': 11, 'alpha_categorical': 'scalar', 'eta_categorical': 'symmetric', 'alpha': 0.048446647006883156}. Best is trial 2 with value: 0.48890779668428136.
[I 2023-08-08 11:52:14,943] Trial 8 finished with value: 0.5479971959865181 and parameters: {'num_topics': 22, 'alpha_categorical': 'symmetric', 'eta_categorical': 'symmetric'}. Best is trial 8 with value: 0.5479971959865181.
[I 2023-08-08 11:52:54,734] Trial 9 finished with value: 0.514077416943665 and parameters: {'num_topics': 10, 'alpha_categorical': 'symmetric', 'eta_categorical': 'scalar', 'eta': 0.9702661489117552}. Best is trial 8 with value: 0.5479971959865181.
[I 2023-08-08 11:53:33,292] Trial 10 finished with value: 0.5389421828020653 and parameters: {'num_topics': 23, 'alpha_categorical': 'symmetric', 'eta_categorical': 'symmetric'}. Best is trial 8 with value: 0.5479971959865181.
[I 2023-08-08 11:54:12,934] Trial 11 finished with value: 0.536724208754813 and parameters: {'num_topics': 23, 'alpha_categorical': 'symmetric', 'eta_categorical': 'symmetric'}. Best is trial 8 with value: 0.5479971959865181.
[I 2023-08-08 11:54:52,714] Trial 12 finished with value: 0.5494865826483375 and parameters: {'num_topics': 19, 'alpha_categorical': 'symmetric', 'eta_categorical': 'symmetric'}. Best is trial 12 with value: 0.5494865826483375.
[I 2023-08-08 11:55:35,385] Trial 13 finished with value: 0.534786089882444 and parameters: {'num_topics': 17, 'alpha_categorical': 'symmetric', 'eta_categorical': 'symmetric'}. Best is trial 12 with value: 0.5494865826483375.
[I 2023-08-08 11:56:13,952] Trial 14 finished with value: 0.49956157506117954 and parameters: {'num_topics': 30, 'alpha_categorical': 'symmetric', 'eta_categorical': 'symmetric'}. Best is trial 12 with value: 0.5494865826483375.
[I 2023-08-08 11:56:50,243] Trial 15 finished with value: 0.534786089882444 and parameters: {'num_topics': 17, 'alpha_categorical': 'symmetric', 'eta_categorical': 'symmetric'}. Best is trial 12 with value: 0.5494865826483375.
[I 2023-08-08 11:57:26,818] Trial 16 finished with value: 0.534786089882444 and parameters: {'num_topics': 17, 'alpha_categorical': 'symmetric', 'eta_categorical': 'symmetric'}. Best is trial 12 with value: 0.5494865826483375.
[I 2023-08-08 11:58:04,995] Trial 17 finished with value: 0.5526724262172075 and parameters: {'num_topics': 29, 'alpha_categorical': 'symmetric', 'eta_categorical': 'symmetric'}. Best is trial 17 with value: 0.5526724262172075.
[I 2023-08-08 11:58:33,570] Trial 18 finished with value: 0.4177497172293495 and parameters: {'num_topics': 30, 'alpha_categorical': 'scalar', 'eta_categorical': 'symmetric', 'alpha': 0.935493264835799}. Best is trial 17 with value: 0.5526724262172075.
[I 2023-08-08 11:59:12,293] Trial 19 finished with value: 0.519567926867838 and parameters: {'num_topics': 27, 'alpha_categorical': 'asymmetric', 'eta_categorical': 'symmetric'}. Best is trial 17 with value: 0.5526724262172075.
[I 2023-08-08 11:59:52,226] A new study created in memory with name: no-name-7d50e394-7606-49c7-831a-08a4b3083ee9
[I 2023-08-08 12:00:31,390] Trial 0 finished with value: 0.3924862543768323 and parameters: {'num_topics': 24, 'alpha_categorical': 'scalar', 'eta_categorical': 'scalar', 'alpha': 0.11613510652229311, 'eta': 0.04025262651579341}. Best is trial 0 with value: 0.3924862543768323.
[I 2023-08-08 12:01:10,313] Trial 1 finished with value: 0.4115190453896665 and parameters: {'num_topics': 21, 'alpha_categorical': 'symmetric', 'eta_categorical': 'scalar', 'eta': 0.41253610431064036}. Best is trial 1 with value: 0.4115190453896665.
[I 2023-08-08 12:01:48,151] Trial 2 finished with value: 0.39089235263702776 and parameters: {'num_topics': 34, 'alpha_categorical': 'symmetric', 'eta_categorical': 'scalar', 'eta': 0.43271046911648725}. Best is trial 1 with value: 0.4115190453896665.
[I 2023-08-08 12:02:25,020] Trial 3 finished with value: 0.36635724317770396 and parameters: {'num_topics': 27, 'alpha_categorical': 'symmetric', 'eta_categorical': 'symmetric'}. Best is trial 1 with value: 0.4115190453896665.
[I 2023-08-08 12:03:04,499] Trial 4 finished with value: 0.37648141189476647 and parameters: {'num_topics': 14, 'alpha_categorical': 'asymmetric', 'eta_categorical': 'scalar', 'eta': 0.6256506969981565}. Best is trial 1 with value: 0.4115190453896665.
[I 2023-08-08 12:03:31,752] Trial 5 finished with value: 0.3408704337185771 and parameters: {'num_topics': 36, 'alpha_categorical': 'scalar', 'eta_categorical': 'scalar', 'alpha': 0.6015782894355554, 'eta': 0.6797139570738273}. Best is trial 1 with value: 0.4115190453896665.
[I 2023-08-08 12:04:06,781] Trial 6 finished with value: 0.3816196647427874 and parameters: {'num_topics': 35, 'alpha_categorical': 'symmetric', 'eta_categorical': 'symmetric'}. Best is trial 1 with value: 0.4115190453896665.
[I 2023-08-08 12:04:44,446] Trial 7 finished with value: 0.3408189509150887 and parameters: {'num_topics': 40, 'alpha_categorical': 'asymmetric', 'eta_categorical': 'symmetric'}. Best is trial 1 with value: 0.4115190453896665.
[I 2023-08-08 12:05:08,738] Trial 8 finished with value: 0.3382110671987305 and parameters: {'num_topics': 16, 'alpha_categorical': 'scalar', 'eta_categorical': 'scalar', 'alpha': 0.9721637650647278, 'eta': 0.9145933242183952}. Best is trial 1 with value: 0.4115190453896665.
[I 2023-08-08 12:05:35,292] Trial 9 finished with value: 0.33951386000220807 and parameters: {'num_topics': 36, 'alpha_categorical': 'scalar', 'eta_categorical': 'symmetric', 'alpha': 0.8419337917757826}. Best is trial 1 with value: 0.4115190453896665.
[I 2023-08-08 12:06:06,997] Trial 10 finished with value: 0.4021384390481195 and parameters: {'num_topics': 5, 'alpha_categorical': 'symmetric', 'eta_categorical': 'scalar', 'eta': 0.31439213929662657}. Best is trial 1 with value: 0.4115190453896665.
[I 2023-08-08 12:06:48,577] Trial 11 finished with value: 0.404721739196744 and parameters: {'num_topics': 5, 'alpha_categorical': 'symmetric', 'eta_categorical': 'scalar', 'eta': 0.3172178750914695}. Best is trial 1 with value: 0.4115190453896665.
[I 2023-08-08 12:07:25,066] Trial 12 finished with value: 0.404721739196744 and parameters: {'num_topics': 5, 'alpha_categorical': 'symmetric', 'eta_categorical': 'scalar', 'eta': 0.27207328427080724}. Best is trial 1 with value: 0.4115190453896665.
[I 2023-08-08 12:08:02,279] Trial 13 finished with value: 0.4193006816463664 and parameters: {'num_topics': 12, 'alpha_categorical': 'symmetric', 'eta_categorical': 'scalar', 'eta': 0.2213074737796768}. Best is trial 13 with value: 0.4193006816463664.
[I 2023-08-08 12:08:35,172] Trial 14 finished with value: 0.4215726278679854 and parameters: {'num_topics': 17, 'alpha_categorical': 'symmetric', 'eta_categorical': 'scalar', 'eta': 0.04527420350431677}. Best is trial 14 with value: 0.4215726278679854.
[I 2023-08-08 12:09:05,651] Trial 15 finished with value: 0.42323650174243294 and parameters: {'num_topics': 12, 'alpha_categorical': 'symmetric', 'eta_categorical': 'scalar', 'eta': 0.0016358128606664968}. Best is trial 15 with value: 0.42323650174243294.
[I 2023-08-08 12:09:43,348] Trial 16 finished with value: 0.36868195856043484 and parameters: {'num_topics': 18, 'alpha_categorical': 'asymmetric', 'eta_categorical': 'scalar', 'eta': 0.034115044140765265}. Best is trial 15 with value: 0.42323650174243294.
[I 2023-08-08 12:10:15,269] Trial 17 finished with value: 0.4227430825081057 and parameters: {'num_topics': 12, 'alpha_categorical': 'symmetric', 'eta_categorical': 'scalar', 'eta': 0.016841364911294416}. Best is trial 15 with value: 0.42323650174243294.
[I 2023-08-08 12:10:47,275] Trial 18 finished with value: 0.4176965883878494 and parameters: {'num_topics': 10, 'alpha_categorical': 'symmetric', 'eta_categorical': 'symmetric'}. Best is trial 15 with value: 0.42323650174243294.
[I 2023-08-08 12:11:18,694] Trial 19 finished with value: 0.4408596787515033 and parameters: {'num_topics': 10, 'alpha_categorical': 'asymmetric', 'eta_categorical': 'scalar', 'eta': 0.1413957092868313}. Best is trial 19 with value: 0.4408596787515033.
[I 2023-08-08 12:11:50,802] A new study created in memory with name: no-name-a2fa9e15-d1d8-494d-abe7-e4cb9376a130
[I 2023-08-08 12:12:51,232] Trial 0 finished with value: 0.3427304139980638 and parameters: {'num_topics': 7, 'alpha_categorical': 'asymmetric', 'eta_categorical': 'symmetric'}. Best is trial 0 with value: 0.3427304139980638.
[I 2023-08-08 12:13:50,105] Trial 1 finished with value: 0.341456419815646 and parameters: {'num_topics': 9, 'alpha_categorical': 'symmetric', 'eta_categorical': 'scalar', 'eta': 0.7774720221500218}. Best is trial 0 with value: 0.3427304139980638.
[I 2023-08-08 12:14:55,283] Trial 2 finished with value: 0.3453984211840171 and parameters: {'num_topics': 17, 'alpha_categorical': 'asymmetric', 'eta_categorical': 'symmetric'}. Best is trial 2 with value: 0.3453984211840171.
[I 2023-08-08 12:15:59,715] Trial 3 finished with value: 0.33978618844924824 and parameters: {'num_topics': 27, 'alpha_categorical': 'symmetric', 'eta_categorical': 'scalar', 'eta': 0.7687278012567459}. Best is trial 2 with value: 0.3453984211840171.
[I 2023-08-08 12:17:04,352] Trial 4 finished with value: 0.33920936727901146 and parameters: {'num_topics': 29, 'alpha_categorical': 'scalar', 'eta_categorical': 'scalar', 'alpha': 0.7342111850844011, 'eta': 0.8320720363056731}. Best is trial 2 with value: 0.3453984211840171.
[I 2023-08-08 12:18:05,467] Trial 5 finished with value: 0.34281549251519294 and parameters: {'num_topics': 17, 'alpha_categorical': 'scalar', 'eta_categorical': 'scalar', 'alpha': 0.9214045035980275, 'eta': 0.13104673624251847}. Best is trial 2 with value: 0.3453984211840171.
[I 2023-08-08 12:19:14,402] Trial 6 finished with value: 0.345207946999725 and parameters: {'num_topics': 28, 'alpha_categorical': 'asymmetric', 'eta_categorical': 'scalar', 'eta': 0.1314091743427029}. Best is trial 2 with value: 0.3453984211840171.
[I 2023-08-08 12:20:20,479] Trial 7 finished with value: 0.3454797598213562 and parameters: {'num_topics': 24, 'alpha_categorical': 'asymmetric', 'eta_categorical': 'scalar', 'eta': 0.028921024332325213}. Best is trial 7 with value: 0.3454797598213562.
[I 2023-08-08 12:21:28,928] Trial 8 finished with value: 0.33993420741989466 and parameters: {'num_topics': 31, 'alpha_categorical': 'scalar', 'eta_categorical': 'scalar', 'alpha': 0.2540461811793943, 'eta': 0.7610326300184188}. Best is trial 7 with value: 0.3454797598213562.
[I 2023-08-08 12:22:32,731] Trial 9 finished with value: 0.3457674191915348 and parameters: {'num_topics': 21, 'alpha_categorical': 'scalar', 'eta_categorical': 'symmetric', 'alpha': 0.5024232716901265}. Best is trial 9 with value: 0.3457674191915348.
[I 2023-08-08 12:23:53,078] Trial 10 finished with value: 0.3443189845715784 and parameters: {'num_topics': 39, 'alpha_categorical': 'scalar', 'eta_categorical': 'symmetric', 'alpha': 0.41655586113526377}. Best is trial 9 with value: 0.3457674191915348.
[I 2023-08-08 12:24:55,371] Trial 11 finished with value: 0.3447769363252244 and parameters: {'num_topics': 20, 'alpha_categorical': 'asymmetric', 'eta_categorical': 'symmetric'}. Best is trial 9 with value: 0.3457674191915348.
[I 2023-08-08 12:25:58,742] Trial 12 finished with value: 0.3458704684199958 and parameters: {'num_topics': 23, 'alpha_categorical': 'scalar', 'eta_categorical': 'symmetric', 'alpha': 0.01642540330408382}. Best is trial 12 with value: 0.3458704684199958.
[I 2023-08-08 12:26:57,530] Trial 13 finished with value: 0.3423474080256443 and parameters: {'num_topics': 12, 'alpha_categorical': 'scalar', 'eta_categorical': 'symmetric', 'alpha': 0.030577962323349826}. Best is trial 12 with value: 0.3458704684199958.
[I 2023-08-08 12:28:10,149] Trial 14 finished with value: 0.3447679428938892 and parameters: {'num_topics': 35, 'alpha_categorical': 'scalar', 'eta_categorical': 'symmetric', 'alpha': 0.5356005195405064}. Best is trial 12 with value: 0.3458704684199958.
[I 2023-08-08 12:29:13,032] Trial 15 finished with value: 0.3452526106761195 and parameters: {'num_topics': 22, 'alpha_categorical': 'scalar', 'eta_categorical': 'symmetric', 'alpha': 0.004652715626215071}. Best is trial 12 with value: 0.3458704684199958.
[I 2023-08-08 12:30:12,904] Trial 16 finished with value: 0.34476189713841454 and parameters: {'num_topics': 13, 'alpha_categorical': 'scalar', 'eta_categorical': 'symmetric', 'alpha': 0.3027708032003168}. Best is trial 12 with value: 0.3458704684199958.
[I 2023-08-08 12:31:13,378] Trial 17 finished with value: 0.3463529145693388 and parameters: {'num_topics': 17, 'alpha_categorical': 'symmetric', 'eta_categorical': 'symmetric'}. Best is trial 17 with value: 0.3463529145693388.
[I 2023-08-08 12:32:13,589] Trial 18 finished with value: 0.345124184761314 and parameters: {'num_topics': 16, 'alpha_categorical': 'symmetric', 'eta_categorical': 'symmetric'}. Best is trial 17 with value: 0.3463529145693388.
[I 2023-08-08 12:33:09,449] Trial 19 finished with value: 0.3414344435606447 and parameters: {'num_topics': 5, 'alpha_categorical': 'symmetric', 'eta_categorical': 'symmetric'}. Best is trial 17 with value: 0.3463529145693388.
[I 2023-08-08 12:34:09,613] A new study created in memory with name: no-name-1e1343cc-1dbc-4125-b954-2cf902058004
[I 2023-08-08 12:34:44,929] Trial 0 finished with value: 0.4138909946217228 and parameters: {'num_topics': 31, 'alpha_categorical': 'symmetric', 'eta_categorical': 'scalar', 'eta': 0.13077477809585292}. Best is trial 0 with value: 0.4138909946217228.
[I 2023-08-08 12:35:14,162] Trial 1 finished with value: 0.4088402419652552 and parameters: {'num_topics': 10, 'alpha_categorical': 'asymmetric', 'eta_categorical': 'symmetric'}. Best is trial 0 with value: 0.4138909946217228.
[I 2023-08-08 12:35:44,773] Trial 2 finished with value: 0.39109443975505187 and parameters: {'num_topics': 27, 'alpha_categorical': 'scalar', 'eta_categorical': 'scalar', 'alpha': 0.6004172098006374, 'eta': 0.729761399836636}. Best is trial 0 with value: 0.4138909946217228.
[I 2023-08-08 12:36:14,764] Trial 3 finished with value: 0.3962511967791007 and parameters: {'num_topics': 11, 'alpha_categorical': 'scalar', 'eta_categorical': 'symmetric', 'alpha': 0.5082352551885929}. Best is trial 0 with value: 0.4138909946217228.
[I 2023-08-08 12:36:44,540] Trial 4 finished with value: 0.3990084345591848 and parameters: {'num_topics': 13, 'alpha_categorical': 'symmetric', 'eta_categorical': 'symmetric'}. Best is trial 0 with value: 0.4138909946217228.
[I 2023-08-08 12:37:13,992] Trial 5 finished with value: 0.3984551183720097 and parameters: {'num_topics': 7, 'alpha_categorical': 'scalar', 'eta_categorical': 'scalar', 'alpha': 0.2538399781311151, 'eta': 0.33219936846290404}. Best is trial 0 with value: 0.4138909946217228.
