[I 2023-08-08 12:37:44,858] Trial 6 finished with value: 0.3932389006036062 and parameters: {'num_topics': 21, 'alpha_categorical': 'scalar', 'eta_categorical': 'symmetric', 'alpha': 0.872192232872571}. Best is trial 0 with value: 0.4138909946217228.
[I 2023-08-08 12:38:20,474] Trial 7 finished with value: 0.41495616288413745 and parameters: {'num_topics': 33, 'alpha_categorical': 'asymmetric', 'eta_categorical': 'scalar', 'eta': 0.149068703625451}. Best is trial 7 with value: 0.41495616288413745.
[I 2023-08-08 12:38:54,831] Trial 8 finished with value: 0.40360439370796725 and parameters: {'num_topics': 30, 'alpha_categorical': 'asymmetric', 'eta_categorical': 'scalar', 'eta': 0.4756348222147069}. Best is trial 7 with value: 0.41495616288413745.
[I 2023-08-08 12:39:26,642] Trial 9 finished with value: 0.40271352195209414 and parameters: {'num_topics': 23, 'alpha_categorical': 'scalar', 'eta_categorical': 'symmetric', 'alpha': 0.300966465435609}. Best is trial 7 with value: 0.41495616288413745.
[I 2023-08-08 12:40:05,320] Trial 10 finished with value: 0.4101287731801768 and parameters: {'num_topics': 37, 'alpha_categorical': 'asymmetric', 'eta_categorical': 'scalar', 'eta': 0.0023458875848710314}. Best is trial 7 with value: 0.41495616288413745.
[I 2023-08-08 12:40:44,285] Trial 11 finished with value: 0.40738879180229565 and parameters: {'num_topics': 38, 'alpha_categorical': 'symmetric', 'eta_categorical': 'scalar', 'eta': 0.0816453789270687}. Best is trial 7 with value: 0.41495616288413745.
[I 2023-08-08 12:41:19,693] Trial 12 finished with value: 0.4055222178312592 and parameters: {'num_topics': 32, 'alpha_categorical': 'symmetric', 'eta_categorical': 'scalar', 'eta': 0.2645361468125088}. Best is trial 7 with value: 0.41495616288413745.
[I 2023-08-08 12:41:56,630] Trial 13 finished with value: 0.4096372637750998 and parameters: {'num_topics': 34, 'alpha_categorical': 'symmetric', 'eta_categorical': 'scalar', 'eta': 0.17106184128088908}. Best is trial 7 with value: 0.41495616288413745.
[I 2023-08-08 12:42:29,515] Trial 14 finished with value: 0.40676337463757656 and parameters: {'num_topics': 25, 'alpha_categorical': 'asymmetric', 'eta_categorical': 'scalar', 'eta': 0.31960234817560285}. Best is trial 7 with value: 0.41495616288413745.
[I 2023-08-08 12:43:01,150] Trial 15 finished with value: 0.40125077242766766 and parameters: {'num_topics': 19, 'alpha_categorical': 'symmetric', 'eta_categorical': 'scalar', 'eta': 0.003507880954633835}. Best is trial 7 with value: 0.41495616288413745.
[I 2023-08-08 12:43:41,948] Trial 16 finished with value: 0.4064914160382701 and parameters: {'num_topics': 40, 'alpha_categorical': 'asymmetric', 'eta_categorical': 'scalar', 'eta': 0.18977133551182107}. Best is trial 7 with value: 0.41495616288413745.
[I 2023-08-08 12:44:13,977] Trial 17 finished with value: 0.39609920455373493 and parameters: {'num_topics': 29, 'alpha_categorical': 'asymmetric', 'eta_categorical': 'scalar', 'eta': 0.9973741894088521}. Best is trial 7 with value: 0.41495616288413745.
[I 2023-08-08 12:44:49,846] Trial 18 finished with value: 0.4030616720842738 and parameters: {'num_topics': 34, 'alpha_categorical': 'symmetric', 'eta_categorical': 'scalar', 'eta': 0.45380897728335035}. Best is trial 7 with value: 0.41495616288413745.
[I 2023-08-08 12:45:21,206] Trial 19 finished with value: 0.40048228782935885 and parameters: {'num_topics': 17, 'alpha_categorical': 'asymmetric', 'eta_categorical': 'scalar', 'eta': 0.12058820057760776}. Best is trial 7 with value: 0.41495616288413745.
[I 2023-08-08 12:45:56,916] A new study created in memory with name: no-name-28a107c9-79ed-425c-ad89-ec30f537f3b7
[I 2023-08-08 12:46:19,854] Trial 0 finished with value: 0.36046425044380903 and parameters: {'num_topics': 10, 'alpha_categorical': 'scalar', 'eta_categorical': 'scalar', 'alpha': 0.8827364328944379, 'eta': 0.414204725979761}. Best is trial 0 with value: 0.36046425044380903.
[I 2023-08-08 12:46:50,152] Trial 1 finished with value: 0.3678633089745874 and parameters: {'num_topics': 34, 'alpha_categorical': 'asymmetric', 'eta_categorical': 'symmetric'}. Best is trial 1 with value: 0.3678633089745874.
[I 2023-08-08 12:47:13,548] Trial 2 finished with value: 0.3613301952986613 and parameters: {'num_topics': 11, 'alpha_categorical': 'symmetric', 'eta_categorical': 'scalar', 'eta': 0.7959368056815692}. Best is trial 1 with value: 0.3678633089745874.
[I 2023-08-08 12:47:45,533] Trial 3 finished with value: 0.3704070441949073 and parameters: {'num_topics': 38, 'alpha_categorical': 'scalar', 'eta_categorical': 'symmetric', 'alpha': 0.1785620142655024}. Best is trial 3 with value: 0.3704070441949073.
[I 2023-08-08 12:48:10,759] Trial 4 finished with value: 0.36830683029383043 and parameters: {'num_topics': 16, 'alpha_categorical': 'symmetric', 'eta_categorical': 'symmetric'}. Best is trial 3 with value: 0.3704070441949073.
[I 2023-08-08 12:48:39,695] Trial 5 finished with value: 0.3682924548894314 and parameters: {'num_topics': 35, 'alpha_categorical': 'asymmetric', 'eta_categorical': 'scalar', 'eta': 0.6224285596253955}. Best is trial 3 with value: 0.3704070441949073.
[I 2023-08-08 12:49:08,564] Trial 6 finished with value: 0.36560908646784746 and parameters: {'num_topics': 32, 'alpha_categorical': 'asymmetric', 'eta_categorical': 'symmetric'}. Best is trial 3 with value: 0.3704070441949073.
[I 2023-08-08 12:49:40,358] Trial 7 finished with value: 0.3657150054151438 and parameters: {'num_topics': 39, 'alpha_categorical': 'asymmetric', 'eta_categorical': 'scalar', 'eta': 0.6880984061571268}. Best is trial 3 with value: 0.3704070441949073.
[I 2023-08-08 12:50:05,773] Trial 8 finished with value: 0.3687756190520812 and parameters: {'num_topics': 18, 'alpha_categorical': 'scalar', 'eta_categorical': 'scalar', 'alpha': 0.1374835007997369, 'eta': 0.24103346439310652}. Best is trial 3 with value: 0.3704070441949073.
[I 2023-08-08 12:50:30,904] Trial 9 finished with value: 0.365884180362551 and parameters: {'num_topics': 19, 'alpha_categorical': 'symmetric', 'eta_categorical': 'scalar', 'eta': 0.8463628304369512}. Best is trial 3 with value: 0.3704070441949073.
[I 2023-08-08 12:50:57,847] Trial 10 finished with value: 0.36966238220140335 and parameters: {'num_topics': 27, 'alpha_categorical': 'scalar', 'eta_categorical': 'symmetric', 'alpha': 0.02959251106854499}. Best is trial 3 with value: 0.3704070441949073.
[I 2023-08-08 12:51:25,150] Trial 11 finished with value: 0.36966238220140335 and parameters: {'num_topics': 27, 'alpha_categorical': 'scalar', 'eta_categorical': 'symmetric', 'alpha': 0.009430676762615307}. Best is trial 3 with value: 0.3704070441949073.
[I 2023-08-08 12:51:52,266] Trial 12 finished with value: 0.36868394201481636 and parameters: {'num_topics': 25, 'alpha_categorical': 'scalar', 'eta_categorical': 'symmetric', 'alpha': 0.24901609590552765}. Best is trial 3 with value: 0.3704070441949073.
[I 2023-08-08 12:52:24,518] Trial 13 finished with value: 0.36977551569296596 and parameters: {'num_topics': 40, 'alpha_categorical': 'scalar', 'eta_categorical': 'symmetric', 'alpha': 0.35412515174844317}. Best is trial 3 with value: 0.3704070441949073.
[I 2023-08-08 12:52:56,608] Trial 14 finished with value: 0.36750651773103427 and parameters: {'num_topics': 39, 'alpha_categorical': 'scalar', 'eta_categorical': 'symmetric', 'alpha': 0.41838871967561503}. Best is trial 3 with value: 0.3704070441949073.
[I 2023-08-08 12:53:29,013] Trial 15 finished with value: 0.3687239068932608 and parameters: {'num_topics': 40, 'alpha_categorical': 'scalar', 'eta_categorical': 'symmetric', 'alpha': 0.3762733355497743}. Best is trial 3 with value: 0.3704070441949073.
[I 2023-08-08 12:53:56,517] Trial 16 finished with value: 0.3615978764269923 and parameters: {'num_topics': 31, 'alpha_categorical': 'scalar', 'eta_categorical': 'symmetric', 'alpha': 0.5696798252834241}. Best is trial 3 with value: 0.3704070441949073.
[I 2023-08-08 12:54:27,422] Trial 17 finished with value: 0.36647177764593974 and parameters: {'num_topics': 36, 'alpha_categorical': 'scalar', 'eta_categorical': 'symmetric', 'alpha': 0.27331960616196954}. Best is trial 3 with value: 0.3704070441949073.
[I 2023-08-08 12:54:54,719] Trial 18 finished with value: 0.36318036031856354 and parameters: {'num_topics': 29, 'alpha_categorical': 'scalar', 'eta_categorical': 'symmetric', 'alpha': 0.5277765251013915}. Best is trial 3 with value: 0.3704070441949073.
[I 2023-08-08 12:55:20,710] Trial 19 finished with value: 0.3725610143893569 and parameters: {'num_topics': 22, 'alpha_categorical': 'symmetric', 'eta_categorical': 'symmetric'}. Best is trial 19 with value: 0.3725610143893569.
